{
  "host": "hermes",
  "run_key": "2026-04-13:daily-report",
  "report_date": "2026-04-13",
  "verdict": {
    "status": "degraded",
    "reason_summary": "部分 lane 异常，但仍有可发布内容",
    "has_report": true,
    "should_publish": true,
    "should_archive": true,
    "should_notify_ops": true
  },
  "run_state": {
    "run_key": "2026-04-13:daily-report",
    "report_date": "2026-04-13",
    "trigger_kind": "cron",
    "status": "finished",
    "last_verdict": "degraded",
    "has_report_artifact": true,
    "publish_state": {
      "status": "succeeded",
      "summary": "published to Feishu",
      "reference": "feishu://daily-report/2026-04-13"
    },
    "archive_state": {
      "status": "succeeded",
      "summary": "archived to Obsidian",
      "reference": "obsidian://daily-report/2026-04-13.md"
    }
  },
  "report_artifact": {
    "artifact_type": "final_report",
    "report_date": "2026-04-13",
    "title": "AI Agent 日报（2026-04-13）",
    "summary": "今日共整理 1 条有用内容。",
    "body_markdown": "# AI Agent 日报（2026-04-13）\n\n## X 推荐流\n- **agent matrix 这条线索更接近真实工作流，而不是纯流量话题。** 讨论焦点转向 agent matrix 测试思路。 [原帖](https://x.com/beta/status/2)\n\n## 来源\n\n### X 推荐流\n- 来源 1：https://x.com/beta/status/2\n",
    "useful_item_count": 1,
    "source_lanes": [
      "x-feed"
    ]
  },
  "publish_result": {
    "status": "succeeded",
    "target": "feishu",
    "reference": "feishu://daily-report/2026-04-13",
    "error_summary": null
  },
  "archive_result": {
    "status": "succeeded",
    "target": "obsidian",
    "reference": "obsidian://daily-report/2026-04-13.md",
    "error_summary": null
  }
}
